{
  "family": "solitaire",
  "sizing": {
    "sizeSystem": "EU",
    "size": 16.0,
    "innerDiameter": 17.8
  },
  "shank": {
    "profile": "comfort_fit",
    "widthMm": 2.4,
    "thicknessMm": 1.8,
    "widthTaper": {
      "mode": "NONE",
      "bottomRatio": 1.0
    },
    "thicknessTaper": {
      "mode": "NONE",
      "bottomRatio": 1.0
    }
  },
  "shoulders": {
    "modeled": false
  },
  "head": {
    "basketHeightMm": 3.5
  },
  "stoneArrangement": {
    "arrangement": "SINGLE_CENTER",
    "stone": {
      "shape": "round",
      "diameter": 6.5,
      "length": null,
      "width": null,
      "depth": 4.0,
      "orientation": 0.0,
      "narrowWidth": null,
      "source": "PARAMETRIC_REFERENCE",
      "profile": "FACETED_REFERENCE",
      "customOutline": null,
      "measurement": null,
      "importedAsset": null
    }
  },
  "setting": {
    "settingType": "prong",
    "prongCount": 6,
    "prongDiameterMm": 1.1,
    "prongHeightMm": 4.8
  }
}
